,The Prediction for COVID-19 Outbreak in China by using the Concept of Term Structure for the Turning Period,George X. Yuan,Procedia Computer Science,,2021,https://www.sciencedirect.com/science/article/pii/S1877050921008577/pdfft?md5=e55210cbc8f6fa997a22e372b65bb584&pid=1-s2.0-S1877050921008577-main.pdf
,A new model for epidemic prediction: COVID-19 in kingdom saudi arabia case study,Islam Abdalla Mohamed,Materials Today: Proceedings,,2021,https://www.sciencedirect.com/science/article/pii/S2214785321001115/pdfft?md5=4b1ed01e553fa7e75f2d95a63bef25c8&pid=1-s2.0-S2214785321001115-main.pdf
,Cellular Automata in Covid-19 prediction,Piotr Podolski,Procedia Computer Science,,2021,https://www.sciencedirect.com/science/article/pii/S1877050921018494/pdfft?md5=1cba25ff8b54eed0388e31ee4ad9b6e3&pid=1-s2.0-S1877050921018494-main.pdf
,Clarifying predictions for COVID-19 from testing data: The example of New York State,Quentin Griette,Infectious Disease Modelling,,2021,https://www.sciencedirect.com/science/article/pii/S2468042721000026/pdfft?md5=dc3e1a69370a81beca347c3f32bc92c2&pid=1-s2.0-S2468042721000026-main.pdf
,Prediction of COVID-19 - Pneumonia based on Selected Deep Features and One Class Kernel Extreme Learning Machine,Muhammad Attique Khan,Computers & Electrical Engineering,,2020,https://www.sciencedirect.com/science/article/pii/S0045790620308065/pdfft?md5=46de2c888556be05160ba605388235ec&pid=1-s2.0-S0045790620308065-main.pdf
,"Machine learning approaches in COVID-19 diagnosis, mortality, and severity risk prediction: A review",Norah Alballa,Informatics in Medicine Unlocked,,2021,https://www.sciencedirect.com/science/article/pii/S235291482100054X/pdfft?md5=3700fc48b9964503ab524d603dd0c229&pid=1-s2.0-S235291482100054X-main.pdf
,On an interval prediction of COVID-19 development based on a SEIR epidemic model,Denis Efimov,Annual Reviews in Control,,2021,https://www.sciencedirect.com/science/article/pii/S1367578821000067/pdfft?md5=12f2f1a95419252c76abe14a593e5767&pid=1-s2.0-S1367578821000067-main.pdf
,Prediction modelling of COVID using machine learning methods from B-cell dataset,Nikita Jain,Results in Physics,,2021,https://www.sciencedirect.com/science/article/pii/S2211379721000012/pdfft?md5=8dd6d628398a41d660e209336d677034&pid=1-s2.0-S2211379721000012-main.pdf
,"On the prediction of isolation, release, and decease states for COVID-19 patients: A case study in South Korea",Tarik Alafif,ISA Transactions,,2021,https://www.sciencedirect.com/science/article/pii/S0019057820305723/pdfft?md5=46c931d51f1703ff7fc3d1135fe3745f&pid=1-s2.0-S0019057820305723-main.pdf
,Surveillance of Wastewater for Early Epidemic Prediction (SWEEP): Environmental and health security perspectives in the post COVID-19 Anthropocene,Satya Brat Tiwari,Environmental Research,,2021,https://www.sciencedirect.com/science/article/pii/S0013935121001250/pdfft?md5=ccdfd84e83ceeb1ecc595e5063179ad4&pid=1-s2.0-S0013935121001250-main.pdf
,Prediction and mathematical analysis of the outbreak of coronavirus (COVID-19) in Bangladesh,Pabel Shahrear,Results in Applied Mathematics,,2021,https://www.sciencedirect.com/science/article/pii/S2590037421000054/pdfft?md5=2de01e35f4d01b59546d88b1f1702d8f&pid=1-s2.0-S2590037421000054-main.pdf
,Analysis and prediction of COVID-19 epidemic in South Africa,Wei Ding,ISA Transactions,,2021,https://www.sciencedirect.com/science/article/pii/S0019057821000604/pdfft?md5=c367eff281dedd52c5186c88a7f5e1be&pid=1-s2.0-S0019057821000604-main.pdf
,POSA393 Online Risk Calculator Using Machine Learning for Prediction of Survival After Hospital Discharge from COVID-19 Infection,JP Reis Neto,Value in Health,,2022,https://www.sciencedirect.com/science/article/pii/S109830152103014X/pdfft?md5=86fa2386a9c674b63f79a4080b123895&pid=1-s2.0-S109830152103014X-main.pdf
,Interferon-γ-induced protein 10 (IP-10) and serum amyloid A (SAA) are excellent biomarkers for the prediction of COVID-19 progression and severity,Riham Abdel-Hamid Haroun,Life Sciences,,2021,https://www.sciencedirect.com/science/article/pii/S0024320521000047/pdfft?md5=2c014e540ec4ab2bd2e9e54b7e03748e&pid=1-s2.0-S0024320521000047-main.pdf
,An epidemic prediction from analysis of a combined HIV-COVID-19 co-infection model via ABC-fractional operator,Idris Ahmed,Alexandria Engineering,,2021,https://www.sciencedirect.com/science/article/pii/S1110016821000454/pdfft?md5=fbf923e5f8bf0e101eb3a610f451d09e&pid=1-s2.0-S1110016821000454-main.pdf
,Prospective prediction of PTSD and depressive symptoms during social unrest and COVID-19 using a brief online tool,Stephanie MY Wong,Psychiatry Research,,2021,https://www.sciencedirect.com/science/article/pii/S0165178121000706/pdfft?md5=bf19cc0f079bf2e7eb93dd6f59ee3431&pid=1-s2.0-S0165178121000706-main.pdf
,COVID-19 information contact and participation analysis and dynamic prediction in the Chinese Sina-microblog,Fulian Yin,Physica A: Statistical Mechanics and its Applications,,2021,https://www.sciencedirect.com/science/article/pii/S0378437121000601/pdfft?md5=2f53b7dff46eb065041db73ab685df32&pid=1-s2.0-S0378437121000601-main.pdf
,"Immunoinformatics prediction of overlapping CD8+ T-cell, IFN-γ and IL-4 inducer CD4+ T-cell and linear B-cell epitopes based vaccines against COVID-19 (SARS-CoV-2)",Abiodun J. Fatoba,Vaccine,,2021,https://www.sciencedirect.com/science/article/pii/S0264410X21000037/pdfft?md5=aa81a874a596a437bb6091b64cb71c6d&pid=1-s2.0-S0264410X21000037-main.pdf
,A useful and sensitive marker in the prediction of COVID-19 and disease severity: Thiol,Ayse Kaya Kalem,Free Radical Biology and Medicine,,2021,https://www.sciencedirect.com/science/article/pii/S0891584921000824/pdfft?md5=5104e893e2ef74534239a32699f7bc3e&pid=1-s2.0-S0891584921000824-main.pdf
,Volatility spillover between economic sectors in financial crisis prediction: Evidence spanning the great financial crisis and Covid-19 pandemic,Research in International Business and Finance,Research in International Business and Finance,,2021,https://www.sciencedirect.com/science/article/abs/pii/S0275531921000234
,Recalibration of Acute Physiology and Chronic Health Evaluation II (APACHE II) for mortality prediction in an adult intensive care population to include novel COVID pneumonia diagnostic category,R. A. S. Campbell,British Journal of Anaesthesia,,2022,https://www.sciencedirect.com/science/article/abs/pii/S0007091221007133
,Early prediction of severity in coronavirus disease (COVID-19) using quantitative CT imaging,Kunwei Li,Clinical Imaging,,2021,https://www.sciencedirect.com/science/article/pii/S0899707121000590/pdfft?md5=c58e6aeb64cd34436d8081f035eab49d&pid=1-s2.0-S0899707121000590-main.pdf
,Evaluation of serum ferritin for prediction of severity and mortality in COVID-19- A cross sectional study,Sibtain Ahmed,Annals of Medicine and Surgery,,2021,https://www.sciencedirect.com/science/article/pii/S204908012100114X/pdfft?md5=223aa78881d591ff3fa77e64ab232f3b&pid=1-s2.0-S204908012100114X-main.pdf
,Artificial Intelligence-Based Prediction of Covid-19 Severity on the Results of Protein Profiling,Şeyma Yaşar,Computer Methods and Programs in Biomedicine,,2021,https://www.sciencedirect.com/science/article/pii/S0169260721000717/pdfft?md5=57c4a9026e7f51c916a93ce5032c7e4f&pid=1-s2.0-S0169260721000717-main.pdf
,Reservoir hosts prediction for COVID-19 by hybrid transfer learning model,Yun Yang,Journal of Biomedical Informatics,,2021,https://www.sciencedirect.com/science/article/pii/S1532046421000654/pdfft?md5=b646bc1abf284fe07147359a2a9cd963&pid=1-s2.0-S1532046421000654-main.pdf
,Evaluating the Traditional Chinese Medicine (TCM) Officially Recommended in China for COVID-19 Using Ontology-Based Side-Effect Prediction Framework (OSPF) and Deep Learning,Zeheng Wang,Journal of Ethnopharmacology,,2021,https://www.sciencedirect.com/science/article/pii/S0378874121001835/pdfft?md5=0e713b174159930b614ba2fd6a91c730&pid=1-s2.0-S0378874121001835-main.pdf
,IL-6–based mortality prediction model for COVID-19: Validation and update in multicenter and second wave cohorts,Alberto Utrero-Rico,Journal of Allergy and Clinical Immunology,,2021,https://www.sciencedirect.com/science/article/pii/S0091674921003432/pdfft?md5=9dd18b878c8fac73419f90d0de77268d&pid=1-s2.0-S0091674921003432-main.pdf
,An integrated autoencoder-based hybrid CNN-LSTM model for COVID-19 severity prediction from lung ultrasound,Ankan Ghosh Dastider,Computers in Biology and Medicine,,2021,https://www.sciencedirect.com/science/article/pii/S0010482521000901/pdfft?md5=bd4a4506811df6ec3f80dd10dbb30386&pid=1-s2.0-S0010482521000901-main.pdf
,Fractional mathematical modeling for epidemic prediction of COVID-19 in Egypt,W. E. Raslan,Ain Shams Engineering Journal,,2021,https://www.sciencedirect.com/science/article/pii/S2090447921000502/pdfft?md5=eca0656cd64eb7609e5b9a7624d5b61b&pid=1-s2.0-S2090447921000502-main.pdf
,Early prediction keys for COVID-19 cases progression: A meta-analysis,Mostafa M. Khodeir,Journal of Infection and Public Health,,2021,https://www.sciencedirect.com/science/article/pii/S1876034121000587/pdfft?md5=33583e0e95d446f9011882ca9c074840&pid=1-s2.0-S1876034121000587-main.pdf
,Mediative fuzzy logic mathematical model: A contradictory management prediction in COVID-19 pandemic,M. K. Sharma,Applied Soft Computing,,2021,https://www.sciencedirect.com/science/article/pii/S1568494621002088/pdfft?md5=da61312d6c7239ef0737b2f2c5508f5a&pid=1-s2.0-S1568494621002088-main.pdf
,"Corrigendum to “Machine Learning Based Prediction of COVID-19 Mortality Suggests Repositioning of Anticancer Drug for Treating Severe Cases”[Artificial Intelligence in Life Sciences] 1(2021), 100020",Thomas Linden,Artificial Intelligence in the Life Science,,2022,https://www.sciencedirect.com/science/article/pii/S2667318522000034/pdfft?md5=2832e61e74bd3d26dbce46e010e126a5&pid=1-s2.0-S2667318522000034-main.pdf
,Short-term predictions and prevention strategies for COVID-19: A model-based study,Sk Shahid Nadim,Applied Mathematics and Computation,,2021,https://www.sciencedirect.com/science/article/pii/S0096300321003416/pdfft?md5=0e52ebe8d39c02bddd342312cdb70447&pid=1-s2.0-S0096300321003416-main.pdf
,Simulation and prediction of spread of COVID-19 in The Republic of Serbia by SEAIHRDS model of disease transmission,Slavoljub Stanojevic,Microbial Risk Analysis,,2021,https://www.sciencedirect.com/science/article/pii/S2352352221000037/pdfft?md5=a8d1bed95b36483e5ff83b715c3269ad&pid=1-s2.0-S2352352221000037-main.pdf
,Maximum likelihood-based extended Kalman filter for COVID-19 prediction,Jialu Song,"Chaos, Solitons & Fractals",,2021,https://www.sciencedirect.com/science/article/pii/S0960077921002769/pdfft?md5=17ebe1348042ede96a7d6dc16592eef7&pid=1-s2.0-S0960077921002769-main.pdf
,Identifying the predictors of Covid-19 infection outcomes and development of prediction models,Rashid M. Ansari,Journal of Infection and Public Health,,2021,https://www.sciencedirect.com/science/article/pii/S187603412100071X/pdfft?md5=f32ecdfb45fdf3324606e4536a37afe8&pid=1-s2.0-S187603412100071X-main.pdf
,The COVID-19 (SARS-CoV-2) uncertainty tripod in Brazil: Assessments on model-based predictions with large under-reporting,Saulo B. Bastos,Alexandria Engineering Journal,,2021,https://www.sciencedirect.com/science/article/pii/S1110016821001599/pdfft?md5=ae45b6686a3410c913b153a342470576&pid=1-s2.0-S1110016821001599-main.pdf
,"Prediction of Symptomatic Venous Thromboembolism in Covid-19 Patients: A Retrospective Comparison of Caprini, Padua, and IMPROVE-DD Scores",Kirill Lobastov,Journal of Vascular Surgery: Venous and Lymphatic Disorders,,2022,https://www.sciencedirect.com/science/article/pii/S2213333X21006661/pdfft?md5=977896bf9bd078fed4a7a89328bf223f&pid=1-s2.0-S2213333X21006661-main.pdf
,PREDICTION OF HOSPITALIZATION AND ICU ADMISSION FOR ONTARIO COVID-19 PATIENTS WITH CARDIAC COMORBIDITIES,Abigail Kearney,Journal of the American College of Cardiology,,2022,https://www.sciencedirect.com/science/article/pii/S0735109722028340/pdfft?md5=0d9495f8eb64410493979fc909a9fe3f&pid=1-s2.0-S0735109722028340-main.pdf
,CoV2-Detect-Net: Design of COVID-19 prediction model based on hybrid DE-PSO with SVM using chest X-ray images,Abhishek Dixit,Information Sciences,,2021,https://www.sciencedirect.com/science/article/pii/S0020025521003133/pdfft?md5=e96a98aa8e61c3c9cf8a3cffc56b529f&pid=1-s2.0-S0020025521003133-main.pdf
,Gradient-based grey wolf optimizer with Gaussian walk: Application in modelling and prediction of the COVID-19 pandemic,Soheyl Khalilpourazari,Expert Systems with Applications,,2021,https://www.sciencedirect.com/science/article/pii/S0957417421003614/pdfft?md5=faa9c504e8bcfd44a82def96fe0c5258&pid=1-s2.0-S0957417421003614-main.pdf
,Prediction of hospital-onset COVID-19 using networks of patient contact: an observational study,A. Myall,International Journal of Infectious Diseases,,2021,https://www.sciencedirect.com/science/article/pii/S1201971221011504/pdfft?md5=09f5737693a454bd68e60f24d8413cff&pid=1-s2.0-S1201971221011504-main.pdf
,Diagnostic prediction of COVID-19 based on clinical and radiological findings in a relatively low COVID-19 prevalence area,Yosuke Amano,Respiratory Investigation,,2021,https://www.sciencedirect.com/science/article/pii/S2212534521000459/pdfft?md5=4587f30b3ee7a0b4a0f6a7e5556424d6&pid=1-s2.0-S2212534521000459-main.pdf
,External validation and update of prediction models for unfavorable outcomes in hospitalized patients with COVID-19 in Japan,Gen Yamada,Journal of Infection and Chemotherapy,,2021,https://www.sciencedirect.com/science/article/pii/S1341321X2100115X/pdfft?md5=c49bd43922f4e392ee21c9c8d36d41d2&pid=1-s2.0-S1341321X2100115X-main.pdf
,Prediction of COVID-19 growth and trend using machine learning approach,E. Gothai,Materials Today: Proceedings,,2021,https://www.sciencedirect.com/science/article/pii/S2214785321029059/pdfft?md5=facd6f645a306b506f4c9070e126b5eb&pid=1-s2.0-S2214785321029059-main.pdf
,On sparse ensemble methods: An application to short-term predictions of the evolution of COVID-19,Sandra Benítez-Peña,European Journal of Operational Research,,2021,https://www.sciencedirect.com/science/article/pii/S0377221721003283/pdfft?md5=605d70fd33426841b51c006bbe421422&pid=1-s2.0-S0377221721003283-main.pdf
,Modified SIRD Model for COVID-19 Spread Prediction for Northern and Southern States of India,Sakshi Shringi,"Chaos, Solitons & Fractals",,2021,https://www.sciencedirect.com/science/article/pii/S0960077921003933/pdfft?md5=b6d44b8c9dd1cce3e7626fbbcca5d739&pid=1-s2.0-S0960077921003933-main.pdf
,"Robust prediction of mortality of COVID-19 patients based on quantitative, operator-independent, lung CT densitometry",Martina Mori,Physica Medica,,2021,https://www.sciencedirect.com/science/article/pii/S1120179721001794/pdfft?md5=e55954fffffdcdbc231a02893605215f&pid=1-s2.0-S1120179721001794-main.pdf
,Machine learning models for the prediction of the SEIRD variables for the COVID-19 pandemic based on a deep dependence analysis of variables,Yullis Quintero,Computers in Biology and Medicine,,2021,https://www.sciencedirect.com/science/article/pii/S0010482521002948/pdfft?md5=8530edc5e175f408560a60aaa8f5d505&pid=1-s2.0-S0010482521002948-main.pdf
,SNS Big Data Analysis Framework for COVID-19 Outbreak Prediction in Smart Healthy City,Abir EL Azzaoui,Sustainable Cities and Society,,2021,https://www.sciencedirect.com/science/article/pii/S2210670721002791/pdfft?md5=60f6db958093fbe3743344873a6a87a6&pid=1-s2.0-S2210670721002791-main.pdf
,Steady state Kalman filter design for cases and deaths prediction of Covid-19 in Greece,N. Assimakis,Results in Physics,,2021,https://www.sciencedirect.com/science/article/pii/S2211379721005131/pdfft?md5=c80a0834029adc33d514fe9f3d55bc27&pid=1-s2.0-S2211379721005131-main.pdf
,Incident atrial fibrillation and its risk prediction in patients developing COVID-19: A machine learning based algorithm approach,Gregory Y. H. Lip,European Journal of Internal Medicine,,2021,https://www.sciencedirect.com/science/article/pii/S0953620521001461/pdfft?md5=fbc4644d3c7d03b476ae8e8a97da457e&pid=1-s2.0-S0953620521001461-main.pdf
,Diagnosis and prediction of COVID-19 severity: can biochemical tests and machine learning be used as prognostic indicators?,Alexandre de Fátima Cobre,Computers in Biology and Medicine,,2021,https://www.sciencedirect.com/science/article/pii/S0010482521003255/pdfft?md5=f1ad4b9d820bb818b9dd2669a35f1488&pid=1-s2.0-S0010482521003255-main.pdf
,Bi-Level Prediction Model for Screening COVID-19 Patients Using Chest X-Ray Images,Soham Das,Big Data Research,,2021,https://www.sciencedirect.com/science/article/pii/S2214579621000502/pdfft?md5=63e16a55b11b44db558ea48500584036&pid=1-s2.0-S2214579621000502-main.pdf
,Personalized Prediction of Hospital Mortality in COVID-19–Positive Patients,Daniel Rozenbaum,"Mayo Clinic Proceedings: Innovations, Quality & Outcomes",,2021,https://www.sciencedirect.com/science/article/pii/S2542454821000680/pdfft?md5=2f83827cce8ff3e507c3efb6c8bae1a0&pid=1-s2.0-S2542454821000680-main.pdf
,"Modeling, analysis and prediction of new variants of covid-19 and dengue co-infection on complex network",Attiq ul Rehman,"Chaos, Solitons & Fractals",,2021,https://www.sciencedirect.com/science/article/pii/S0960077921003623/pdfft?md5=8c14cae7d15f0f4419efbcedb1e07eb1&pid=1-s2.0-S0960077921003623-main.pdf
,"PM2.5 concentration prediction during COVID-19 lockdown over Kolkata metropolitan city, India using MLR and ANN models",Biswajit Bera,Environmental Challenges,,2021,https://www.sciencedirect.com/science/article/pii/S2667010021001347/pdfft?md5=8e31743ea320a6f865724c5bcfaeff2e&pid=1-s2.0-S2667010021001347-main.pdf
,Development and Validation of a Web-Based Severe COVID-19 Risk Prediction Model,Sang H. Woo,The American Journal of the Medical Sciences,,2021,https://www.sciencedirect.com/science/article/pii/S0002962921001129/pdfft?md5=09735ea1aca96909c9d19d756dd31f6b&pid=1-s2.0-S0002962921001129-main.pdf
,An external validation of the QCovid risk prediction algorithm for risk of mortality from COVID-19 in adults: a national validation cohort study in England,Vahé Nafilyan,The Lancet Digital Health,,2021,https://www.sciencedirect.com/science/article/pii/S2589750021000807/pdfft?md5=cf27a89d5edb02cb533eadaf5c059d50&pid=1-s2.0-S2589750021000807-main.pdf
,The interplay of stress and electrocortical reactivity to reward in the prospective prediction of depression symptoms during COVID-19,Cope Feurer,Journal of Psychiatric Research,,2021,https://www.sciencedirect.com/science/article/pii/S0022395621003034/pdfft?md5=45cb8b61107b3586fd2f266205aa5ad3&pid=1-s2.0-S0022395621003034-main.pdf
,Time-variant reliability-based prediction of COVID-19 spread using extended SEIVR model and Monte Carlo sampling,Mahdi Shadabfar,Results in Physics,,2021,https://www.sciencedirect.com/science/article/pii/S2211379721004897/pdfft?md5=f381b0756fc55be137d459452aec7dc1&pid=1-s2.0-S2211379721004897-main.pdf
,Short-term prediction of COVID-19 spread using grey rolling model optimized by particle swarm optimization,Zeynep Ceylan,Applied Soft Computing,,2021,https://www.sciencedirect.com/science/article/pii/S1568494621005135/pdfft?md5=b915be6ff8c8263403fbac74a0553f5c&pid=1-s2.0-S1568494621005135-main.pdf
,Risk factors and prediction nomogram model for psychosocial and behavioural problems among children and adolescents during the COVID-19 pandemic: A national multicentre study: Risk Factors of Childhood Psychosocial Problems,Lin Wang,Journal of Affective Disorders,,2022,https://www.sciencedirect.com/science/article/pii/S0165032721006637/pdfft?md5=428523e580f92eaf2b75a876a99cda27&pid=1-s2.0-S0165032721006637-main.pdf
,Prédiction de la survie à 90 jours des patients atteints de COVID-19 hospitalisés en réanimation : Survival Of Severely Ill COVID (SOSIC) scores,D. David Hajage,Revue d'Épidémiologie et de Santé Publique,,2022,https://www.sciencedirect.com/science/article/pii/S039876202200178X/pdfft?md5=156ed46b662a093554d5a29ab22419fb&pid=1-s2.0-S039876202200178X-main.pdf
,"Comparison of IMPROVE, modified IMPROVE, IMPROVEDD, Padua and CHA2DS2-VASC risk scores for venous and arterial thrombotic events prediction in hospitalized COVID-19 patients",Marko Lucijanic,Thrombosis Research,,2022,https://www.sciencedirect.com/science/article/pii/S0049384822001402/pdfft?md5=45e265d5a0aaef0b098cbc1232a0c4ca&pid=1-s2.0-S0049384822001402-main.pdf
,Real-time prediction of COVID-19 patients health situations using Artificial Neural Networks and Fuzzy Interval Mathematical modeling,Mohamed Ali Elleuch,Applied Soft Computing,,2021,https://www.sciencedirect.com/science/article/pii/S1568494621005640/pdfft?md5=456ba39395fa93346b331c25e1969176&pid=1-s2.0-S1568494621005640-main.pdf
,Prediction model for the spread of the COVID-19 outbreak in the global environment,Ron S. Hirschprung,Heliyon,,2021,https://www.sciencedirect.com/science/article/pii/S240584402101519X/pdfft?md5=0feaeb5e5c21a2b8a4de38b1a3b8c209&pid=1-s2.0-S240584402101519X-main.pdf
,Outbreak prediction of COVID-19 using Recurrent neural network with Gated Recurrent Units,Sathish Natarajan,Materials Today: Proceedings,,2021,https://www.sciencedirect.com/science/article/pii/S2214785321051257/pdfft?md5=230974feb87e723063a4acdf0925c7f3&pid=1-s2.0-S2214785321051257-main.pdf
,Weakly unsupervised conditional generative adversarial network for image-based prognostic prediction for COVID-19 patients based on chest CT,Tomoki Uemura,Medical Image Analysis,,2021,https://www.sciencedirect.com/science/article/pii/S136184152100205X/pdfft?md5=eeb3c06dbf1d3858a8f7a915946213c2&pid=1-s2.0-S136184152100205X-main.pdf
,A novel hybrid fuzzy time series model for prediction of COVID-19 infected cases and deaths in India,Niteesh Kumar,ISA Transactions,,2021,https://www.sciencedirect.com/science/article/pii/S0019057821003700/pdfft?md5=0a57c61b5f95c761809a50c7636f94ff&pid=1-s2.0-S0019057821003700-main.pdf
,Clinical Utility of Biochemical Markers for the Prediction of COVID-19−Related Mortality in Kidney Transplant Recipients,Sophie Caillard,Kidney International Reports,,2021,https://www.sciencedirect.com/science/article/pii/S2468024921012948/pdfft?md5=672bb86ddc6e1f7a85bcbb31a3456e39&pid=1-s2.0-S2468024921012948-main.pdf
,Outbreak prediction of COVID-19 using Recurrent neural network with Gated Recurrent Units,Sathish Natarajan,Materials Today: Proceedings,,2021,https://www.sciencedirect.com/science/article/pii/S2214785321051257/pdfft?md5=230974feb87e723063a4acdf0925c7f3&pid=1-s2.0-S2214785321051257-main.pdf
,On the accuracy of ARIMA based prediction of COVID-19 spread,Haneen Alabdulrazzaq,Results in Physics,,2021,https://www.sciencedirect.com/science/article/pii/S2211379721006197/pdfft?md5=26727264070d592469607ce68e12446c&pid=1-s2.0-S2211379721006197-main.pdf
,Intelligent predictions of Covid disease based on lung CT images using machine learning strategy,B. Prabha,Materials Today: Proceedings,,2021,https://www.sciencedirect.com/science/article/pii/S2214785321052317
,Prediction of generalized anxiety levels during the Covid-19 pandemic: A machine learning-based modeling approach,Faisal Mashel Albagmi,Informatics in Medicine,,2022,https://www.sciencedirect.com/science/article/pii/S2352914822000089/pdfft?md5=ee5092ddbbb75476117080cd1a6cb532&pid=1-s2.0-S2352914822000089-main.pdf
,A new COVID-19 intubation prediction strategy using an intelligent feature selection and K-NN method,Zahra Asghari Varzaneh,Informatics in Medicine,,2022,https://www.sciencedirect.com/science/article/pii/S2352914821002884/pdfft?md5=7043898c7ff0f0a9a316467c4d16d717&pid=1-s2.0-S2352914821002884-main.pdf
,Supervised learning of COVID-19 patients' characteristics to discover symptom patterns and improve patient outcome prediction,Sadegh Ilbeigipour,Informatics in Medicine,,2022,https://www.sciencedirect.com/science/article/pii/S2352914822000818/pdfft?md5=ae65e38eb01b41d1547317ef165a9c4e&pid=1-s2.0-S2352914822000818-main.pdf
,Prediction of COVID-19 Infected Population for Indian States through a State Interaction Network-based SEIR Epidemic Model,Piklu Mallick,IFAC-Papers,,2022,https://www.sciencedirect.com/science/article/pii/S2405896322001136/pdfft?md5=f8e753ea720a493819cb69016ca839af&pid=1-s2.0-S2405896322001136-main.pdf
,Central hubs prediction for bio networks by directed hypergraph - GA with validation to COVID-19 PPI,Sathyanarayanan Gopalakrishnan,Pattern Recognition Letters,,2021,https://www.sciencedirect.com/science/article/pii/S0167865521004463/pdfft?md5=46b9280efe2742fc31431e4935c001b8&pid=1-s2.0-S0167865521004463-main.pdf
,Sensitivity Analysis by the PROMETHEE-GAIA method: Algorithms evaluation for COVID-19 prediction,Miguel Ângelo Lellis Moreira,Procedia Computer Science,,2022,https://www.sciencedirect.com/science/article/pii/S1877050922000527/pdfft?md5=b678339aabaef32f58aec1c91f209c16&pid=1-s2.0-S1877050922000527-main.pdf
,Improving PM2.5 predictions during COVID-19 lockdown by assimilating multi-source observations and adjusting emissions,Liuzhu Chen,Environmental Pollution,,2021,https://www.sciencedirect.com/science/article/pii/S0269749121023654/pdfft?md5=f6310b0847cc9f5bce87efa388f665de&pid=1-s2.0-S0269749121023654-main.pdf
,Self-correcting error-based prediction model for the COVID-19 pandemic and analysis of economic impacts,Xuan Tang,Sustainable Cities and Society,,2021,https://www.sciencedirect.com/science/article/abs/pii/S2210670721004972
,Forecasting seasonal electricity generation in European countries under Covid-19-induced lockdown using fractional grey prediction models and machine learning methods,Utkucan Şahin,Applied Energy,,2021,https://www.sciencedirect.com/science/article/abs/pii/S0306261921009181
,Implementation of stacking based ARIMA model for prediction of Covid-19 cases in India,Aman Swaraj,Journal of Biomedical Informatics,,2021,https://www.sciencedirect.com/science/article/pii/S1532046421002161/pdfft?md5=03b7a7d4173465931a8d913b01db2002&pid=1-s2.0-S1532046421002161-main.pdf
