,Intelligent computing on time-series data analysis and prediction of COVID-19 pandemics,Sujata Dash,Pattern Recognition Letters,,2021,https://www.sciencedirect.com/science/article/pii/S0167865521002762/pdfft?md5=e9daecfc76b4430e76d5ea4e8b2b9b11&pid=1-s2.0-S0167865521002762-main.pdf
,COVID-19 prediction through X-ray images using transfer learning-based hybrid deep learning approach,Mohit Kumar,Materials Today: Proceedings,,2021,https://www.sciencedirect.com/science/article/pii/S2214785321078470/pdfft?md5=303619053db55be9e86eff97c691bc15&pid=1-s2.0-S2214785321078470-main.pdf
,One Shot Model For The Prediction of COVID-19 And Lesions Segmentation In Chest CT Scans Through The Affinity Among Lesion Mask Features,Aram Ter-Sarkisov,Applied Soft Computing,,2021,https://www.sciencedirect.com/science/article/pii/S1568494621010802/pdfft?md5=f2865945571fccf81035ff2d31bdd7d7&pid=1-s2.0-S1568494621010802-main.pdf
,Feature extraction with capsule network for the COVID-19 disease prediction though X-ray images,Pinesh Arvindbhai Darji,Materials Today: Proceedings,,2021,https://www.sciencedirect.com/science/article/pii/S2214785321075337/pdfft?md5=157be5ed758e0dcacec184ab0ed0ad51&pid=1-s2.0-S2214785321075337-main.pdf
,"Prediction of COVID Criticality Score with Laboratory, Clinical and CT Images using Hybrid Regression Models",Varalakshmi Perumal,Computer Methods and Programs in Biomedicine,,2021,https://www.sciencedirect.com/science/article/abs/pii/S0169260721004107
,Prediction and analysis of microRNAs involved in COVID-19 inflammatory processes associated with the NF-kB and JAK/STAT signaling pathways,Zeinab Amini-Farsani,International Immunopharmacology,,2021,https://www.sciencedirect.com/science/article/pii/S1567576921007074/pdfft?md5=73663b75aeeec3cf464e6ac5cc36f6d7&pid=1-s2.0-S1567576921007074-main.pdf
,"Prediction of highly vulnerable areas to COVID-19 outbreaks using spatial model: Case study of Cairo Governorate, Egypt",,The Egyptian Journal of Remote Sensing and Space Science,,2021,https://www.sciencedirect.com/science/article/pii/S1110982321000545/pdfft?md5=cadef8ec34b2d5784728141763401289&pid=1-s2.0-S1110982321000545-main.pdf
,Prediction of the number of COVID-19 confirmed cases based on K-means-LSTM,Shashank Reddy Vadyala,Array,,2021,https://www.sciencedirect.com/science/article/pii/S2590005621000333/pdfft?md5=e8370e10de437350ab0e916537ebfc5c&pid=1-s2.0-S2590005621000333-main.pdf
,Computer-aided prediction of inhibitors against STAT3 for managing COVID-19 associated cytokine storm,Anjali Dhall,Computers in Biology and Medicine,,2021,https://www.sciencedirect.com/science/article/pii/S0010482521005746/pdfft?md5=7735c134cf337626a89ced082354d88a&pid=1-s2.0-S0010482521005746-main.pdf
,"Prediction of mortality in COVID-19 through combing CT severity score with NEWS, qSOFA, or peripheral perfusion index",Gökhan Akdur,The American Journal of Emergency Medicine,,2021,https://www.sciencedirect.com/science/article/pii/S0735675721007191/pdfft?md5=b9a0d4360b780017e6a0dc7303bcc277&pid=1-s2.0-S0735675721007191-main.pdf
,Activity Measure for Post-Acute Care “6-Clicks” for the Prediction of Short-term Clinical Outcomes in Individuals Hospitalized With COVID-19: A Retrospective Cohort Study,Michael A. Tevald,Archives of Physical Medicine and Rehabilitation,,2021,https://www.sciencedirect.com/science/article/pii/S0003999321014155/pdfft?md5=4d71f51e6f24a12af66ee4b1b5f48967&pid=1-s2.0-S0003999321014155-main.pdf
,Prediction on transmission trajectory of COVID-19 based on particle swarm algorithm,Caichang Ding,Pattern Recognition Letters,,2021,https://www.sciencedirect.com/science/article/pii/S0167865521003184/pdfft?md5=1069864d53d9514f832f8f8c6f80c5c2&pid=1-s2.0-S0167865521003184-main.pdf
,SIRVD-DL: A COVID-19 deep learning prediction model based on time-dependent SIRVD,Zhifang Liao,Computers in Biology and Medicine1,,2021,https://www.sciencedirect.com/science/article/pii/S0010482521006624/pdfft?md5=9881033256f31944492c8820e9c00461&pid=1-s2.0-S0010482521006624-main.pdf
,COVID-19 prediction based on genome similarity of human SARS-CoV-2 and bat SARS-CoV-like coronavirus,Hilal Arslan,Computers & Industrial Engineering,,2021,https://www.sciencedirect.com/science/article/pii/S0360835221005702/pdfft?md5=8f9c8e91c7b9f4987986ad958bae5154&pid=1-s2.0-S0360835221005702-main.pdf
,COVID19-HPSMP: COVID-19 adopted Hybrid and Parallel deep information fusion framework for stock price movement prediction,Farnoush Ronaghi,Expert Systems with Applications,,2021,https://www.sciencedirect.com/science/article/pii/S0957417421012380/pdfft?md5=64d42837667fe16daec558c59e697aa5&pid=1-s2.0-S0957417421012380-main.pdf
,Development and Validation of a Multivariable Risk Prediction Model for COVID-19 Mortality in the Southern United States,Aashish Gupta,Mayo Clinic Proceedings,,2021,https://www.sciencedirect.com/science/article/pii/S0025619621006959/pdfft?md5=e808a4ffaa006fd73f1ae1144471d795&pid=1-s2.0-S0025619621006959-main.pdf
,An internally validated prediction model for critical COVID-19 infection and intensive care unit admission in symptomatic pregnant women,Erkan Kalafat,American Journal of Obstetrics and Gynecology,,2021,https://www.sciencedirect.com/science/article/pii/S0002937821010528/pdfft?md5=56159133ccb7e1644d9bbaa9195436db&pid=1-s2.0-S0002937821010528-main.pdf
,"Learning delay dynamics for multivariate stochastic processes, with application to the prediction of the growth rate of COVID-19 cases in the United States",Paromita Dubey,Journal of Mathematical Analysis and Applications,,2021,https://www.sciencedirect.com/science/article/pii/S0022247X21007563/pdfft?md5=b21c2c2613235074019132c169fd8b3e&pid=1-s2.0-S0022247X21007563-main.pdf
,A novel deep interval type-2 fuzzy LSTM (DIT2FLSTM) model applied to COVID-19 pandemic time-series prediction,Aref Safari,Journal of Biomedical Informatics,,2021,https://www.sciencedirect.com/science/article/pii/S1532046421002495/pdfft?md5=832c863d53dc661201399deb78358638&pid=1-s2.0-S1532046421002495-main.pdf
,Development of a scoring system for the prediction of in-hospital mortality among COVID-19 patients,Mohammad Haji Aghajani,Clinical Epidemiology and Global Health,,2021,https://www.sciencedirect.com/science/article/pii/S2213398421001792/pdfft?md5=87108f719e98c695ef38142fb4485b38&pid=1-s2.0-S2213398421001792-main.pdf
,Application of machine learning in the prediction of COVID-19 daily new cases: A scoping review,Soudeh Ghafouri-Fard,Heliyon,,2021,https://www.sciencedirect.com/science/article/pii/S2405844021022465/pdfft?md5=00194a2f25cb32717fe5a76071238518&pid=1-s2.0-S2405844021022465-main.pdf
,Machine Learning Based Prediction of COVID-19 Mortality Suggests Repositioning of Anticancer Drug for Treating Severe Cases,Thomas Linden,Artificial Intelligence in the Life Sciences,,2021,https://www.sciencedirect.com/science/article/pii/S2667318521000209/pdfft?md5=68bd9ddfe54d87ca89e32a4e2867b1bd&pid=1-s2.0-S2667318521000209-main.pdf
,Stress prediction using micro-EMA and machine learning during COVID-19 social isolation,Huining Li,Smart Health,,2021,https://www.sciencedirect.com/science/article/pii/S2352648321000581
,Office buildings occupancy analysis and prediction associated with the impact of the COVID-19 pandemic,Violeta Motuzienė,Sustainable Cities and Society,,2021,https://www.sciencedirect.com/science/article/pii/S2210670721008234
,iVaccine-Deep: Prediction of COVID-19 mRNA vaccine degradation using deep learning,Amgad Muneer,Journal of King Saud University - Computer and Information Sciences,,2021,https://www.sciencedirect.com/science/article/pii/S1319157821002871/pdfft?md5=42dad18f9f2dbe2949ba4c57fe5cc363&pid=1-s2.0-S1319157821002871-main.pdf
,"Review: Roles of human serum albumin in prediction, diagnoses and treatment of COVID-19",Gulam Rabbani,International Journal of Biological Macromolecules,,2021,https://www.sciencedirect.com/science/article/pii/S0141813021022546/pdfft?md5=3f07711dd69c9299c0c677395adfb184&pid=1-s2.0-S0141813021022546-main.pdf
,Weighted butterfly optimization algorithm with intuitionistic fuzzy Gaussian function based adaptive-neuro fuzzy inference system for covid-19 prediction,T. Sundaravadivel,Materials Today: Proceedings,,2021,https://www.sciencedirect.com/science/article/pii/S2214785321066578/pdfft?md5=6dc67c0e84c9c7c8a4ebf0a216e5fe33&pid=1-s2.0-S2214785321066578-main.pdf
,Contrastive learning improves critical event prediction in COVID-19 patients,Tingyi Wanyan,Patterns,,2021,https://www.sciencedirect.com/science/article/pii/S2666389921002567/pdfft?md5=cfed08c249e91ab2870214f4545d5232&pid=1-s2.0-S2666389921002567-main.pdf
,A new hybrid prediction model of cumulative COVID-19 confirmed data,Guohui Li,Process Safety and Environmental Protection,,2021,https://www.sciencedirect.com/science/article/pii/S0957582021005917/pdfft?md5=a0d211ab2cd20ad5c7a9a9a6e74a71d7&pid=1-s2.0-S0957582021005917-main.pdf
,Longitudinal validation of an electronic health record delirium prediction model applied at admission in COVID-19 patients,Victor M. Castro,General Hospital Psychiatry,,2021,https://www.sciencedirect.com/science/article/pii/S0163834321001456/pdfft?md5=6e63ff9b295e316ab1a03a95e3e2421d&pid=1-s2.0-S0163834321001456-main.pdf
,A Decision-Level Fusion Method for COVID-19 Patient Health Prediction,Abdu Gumaei,Big Data Research,,2021,https://www.sciencedirect.com/science/article/pii/S2214579621001040/pdfft?md5=f4dba5f9d5f732f8949d8051c9e81eca&pid=1-s2.0-S2214579621001040-main.pdf
,Individual outcome prediction models for patients with COVID-19 based on their first day of admission to the intensive care unit,Raúl Rigo-Bonnin,Clinical Biochemistry,,2021,https://www.sciencedirect.com/science/article/pii/S0009912021003003/pdfft?md5=031164346aba60dcf8191fdab44f0c04&pid=1-s2.0-S0009912021003003-main.pdf
,"Multivariate data driven prediction of COVID-19 dynamics: Towards new results with temperature, humidity and air quality data",Dunfrey P. Aragão,Environmental Research,,2021,https://www.sciencedirect.com/science/article/pii/S0013935121016492/pdfft?md5=b4fd913b32ab6b132457bc97b8191a70&pid=1-s2.0-S0013935121016492-main.pdf
,Anti-AT1R autoantibodies and prediction of the severity of Covid-19,Franco Papola,Human Immunology,,2021,https://www.sciencedirect.com/science/article/pii/S0198885921002512/pdfft?md5=76f0c4ebca38ccd2ad0d8b307def0802&pid=1-s2.0-S0198885921002512-main.pdf
,"Clinical features, risk factors and a prediction model for in-hospital mortality among diabetic patients infected with COVID-19: data from a referral centre in Iran",Maryam Kabootari,Public Health,,2021,https://www.sciencedirect.com/science/article/pii/S1532046421002847/pdfft?md5=cbf84cc41b36e115f6f9c92a7eaf3f00&pid=1-s2.0-S1532046421002847-main.pdf
,Automatic detection of COVID-19 vaccine misinformation with graph link prediction,Maxwell A. Weinzierl,Journal of Biomedical Informatics,,2021,https://www.sciencedirect.com/science/article/pii/S1532046421002847/pdfft?md5=cbf84cc41b36e115f6f9c92a7eaf3f00&pid=1-s2.0-S1532046421002847-main.pdf