,Short-term real-time prediction of total number of reported COVID-19 cases and deaths in South Africa: a data driven approach,Tarylee ReddyZiv ShkedyCharl Janse van RensburgHenry MwambiPravesh DebbaKhangelani ZumaSamuel Manda,21,,2021,http://link.springer.com/article/10.1186/s12874-020-01165-x
,Hybrid-based framework for COVID-19 prediction via federated machine learning models,Ameni KallelMolka RekikMahdi Khemakhem,78,,2022,http://link.springer.com/article/10.1007/s11227-021-04166-9
,Evaluation of novel coronavirus disease (COVID-19) using quantitative lung CT and clinical data: prediction of short-term outcome,João MatosFrancesco PaparoIlaria MussettoLorenzo BacigalupoAlessio VenezianoSilvia Perugin BernardiEnnio BiscaldiEnrico MelaniGiancarlo AntonucciPaolo CremonesiMarco LattuadaAlberto PilottoEmanuele PontaliGian Andrea Rollandi,4,,2020,http://link.springer.com/article/10.1186/s41747-020-00167-0
,A model integrating Killer Immunoglobulin-like Receptor (KIR) haplotypes for risk prediction of COVID-19 clinical disease severity,Meral BeksacHasan Yalim AkinEmine Begum Gencer-OnculMahsa YousefzadehGuldane Cengiz SevalEzgi GultenIrem Akdemir KalkanGule CinarOsman MemikogluErgun KaraagaogluKlara Dalva,73,,2021,http://link.springer.com/article/10.1007/s00251-021-01227-4
,Network-inference-based prediction of the COVID-19 epidemic outbreak in the Chinese province Hubei,Bastian PrasseMassimo A. AchterbergLong MaPiet Van Mieghem,5,,2020,http://link.springer.com/article/10.1007/s41109-020-00274-2
,Remote smartphone gait monitoring and fall prediction in Parkinson’s disease during the COVID-19 lockdown,Massimo MaranoFrancesco MotoleseMariagrazia RossiAlessandro MagliozziZiv YekutieliVincenzo Di Lazzaro,42,,2021,http://link.springer.com/article/10.1007/s10072-021-05351-7
,Data driven covid-19 spread prediction based on mobility and mask mandate information,Sandipan BanerjeeYongsheng Lian,52,,2022,http://link.springer.com/article/10.1007/s10489-021-02381-8
,Prediction of patients requiring intensive care for COVID-19: development and validation of an integer-based score using data from Centers for Disease Control and Prevention of South Korea,JoonNyung HeoDeokjae HanHyung-Jun KimDaehyun KimYeon-Kyeng LeeDosang LimSung Ok HongMi-Jin ParkBeomman HaWoong Seog,9,,2021,http://link.springer.com/article/10.1186/s40560-021-00527-x
,Artificial intelligence for prediction of COVID-19 progression using CT imaging and clinical data,Robin WangZhicheng JiaoLi YangJi Whae ChoiZeng XiongKasey HalseyThi My Linh TranIan PanScott A. CollinsXue FengJing WuKen ChangLin-Bo ShiShuai YangQi-Zhi YuJie Liu,32,,2022,http://link.springer.com/article/10.1007/s00330-021-08049-8
,Mathematical prediction of the time evolution of the COVID-19 pandemic in Italy by a Gauss error function and Monte Carlo simulations,Ignazio CiufoliniAntonio Paolozzi,135,,2020,http://link.springer.com/article/10.1140/epjp/s13360-020-00383-y
,Surface water quality status and prediction during movement control operation order under COVID-19 pandemic: Case studies in Malaysia,A. NajahF. Y. TeoM. F. ChowY. F. HuangS. D. LatifS. AbdullahM. IsmailA. El-Shafie,18,,2021,http://link.springer.com/article/10.1007/s13762-021-03139-y
,Derivation and validation of the clinical prediction model for COVID-19,Fabrizio FoieniGirolamo SalaJason Giuseppe MognarelliGiulia SuigoDavide ZampiniMatteo PistoiaMariella CiolaTommaso CiampaniCarolina UltoriPaolo Ghiringhelli,15,,2020,http://link.springer.com/article/10.1007/s11739-020-02480-3
,Clinical risk scores for the early prediction of severe outcomes in patients hospitalized for COVID-19,Walter AgenoChiara CogliatiMartina PeregoDomenico GirelliErnesto CrisafulliFrancesca PizzoloOliviero OlivieriMarco CattaneoAlberto BenettiElena CorradiniLorenza BertùAntonello Pietrangelo,16,,2021,http://link.springer.com/article/10.1007/s11739-020-02617-4
,Mathematical prediction of the spreading rate of COVID-19 using entropy-based thermodynamic model,A. GhanbariR. KhordadMostafa Ghaderi-Zefrehei,95,,2021,http://link.springer.com/article/10.1007/s12648-020-01930-0
,"Multivariate analysis of CT imaging, laboratory, and demographical features for prediction of acute kidney injury in COVID-19 patients: a Bi-centric analysis",Stefanie J. HectorsSadjad RiyahiHreedi DevKarthik KrishnanDaniel J. A. MargolisMartin R. Prince,46,,2021,http://link.springer.com/article/10.1007/s00261-020-02823-w
,A new prediction approach of the COVID-19 virus pandemic behavior with a hybrid ensemble modular nonlinear autoregressive neural network,Patricia MelinJulio Cesar MonicaDaniela SanchezOscar Castillo,,,2020,http://link.springer.com/article/10.1007/s00500-020-05452-z
,"An improved mathematical prediction of the time evolution of the Covid-19 pandemic in Italy, with a Monte Carlo simulation and error analyses",Ignazio CiufoliniAntonio Paolozzi,135,,2020,http://link.springer.com/article/10.1140/epjp/s13360-020-00488-4
,Evaluating prediction of COVID-19 at provincial level of South Africa: a statistical perspective,Mohammad ArashiAndriette BekkerMahdi SalehiSollie MillardTanita BothaMohammad Golpaygani,29,,2022,http://link.springer.com/article/10.1007/s11356-021-17291-y
,"Analysis and prediction of worldwide novel coronavirus (COVID-19) infections, using neural network-based techniques",Sachin KamleyR. S. Thakur,5,,2022,http://link.springer.com/article/10.1007/s42044-021-00092-4
,"Analysis of origin, risk factors influencing COVID-19 cases in India and its prediction using ensemble learning",N. RajeshPrasanna Ranjith Christodoss,,,2021,http://link.springer.com/article/10.1007/s13198-021-01356-9
,Comparative Study Based on Analysis of Coronavirus Disease (COVID-19) Detection and Prediction Using Machine Learning Models,R. Sudha AbiramiG. Suresh Kumar,3,,2021,http://link.springer.com/article/10.1007/s42979-021-00965-2
,"Analysis of spatial-temporal distribution of notifiable respiratory infectious diseases in Shandong Province, China during 2005–2014",Xiaomei LiDongzhen ChenYan ZhangXiaojia XueShengyang ZhangMeng ChenXuena LiuGuoyong Ding,21,,2021,http://link.springer.com/article/10.1186/s12889-021-11627-6
,Segmentation and classification on chest radiography: a systematic survey,Tarun AgrawalPrakash Choudhary,,,2022,http://link.springer.com/article/10.1007/s00371-021-02352-7
,Informal urbanism in the state of uncertainty: forms of informality and urban health emergencies,Hesam KamalipourNastaran Peimani,26,,2021,http://link.springer.com/article/10.1057/s41289-020-00145-3
,Abstracts,,46,,2017,http://link.springer.com/article/10.1007/s00249-017-1222-x
,Systems thinking in combating infectious diseases,Shang XiaXiao-Nong ZhouJiming Liu,6,,2017,http://link.springer.com/article/10.1186/s40249-017-0339-6
,"A survey on deep multimodal learning for computer vision: advances, trends, applications, and datasets",Khaled BayoudhRaja KnaniFayçal HamdaouiAbdellatif Mtibaa,,,2021,http://link.springer.com/article/10.1007/s00371-021-02166-7
,Prediction of hospital bed capacity during the COVID− 19 pandemic,Mieke DeschepperKristof EecklooSimon MalfaitDominique BenoitSteven CallensStijn Vansteelandt,21,,2021,http://link.springer.com/article/10.1186/s12913-021-06492-3
,Prediction of COVID-19 spread by sliding mSEIR observer,Duxin ChenYifan YangYifan ZhangWenwu Yu,63,,2020,http://link.springer.com/article/10.1007/s11432-020-3034-y
,"CT severity score in COVID-19 patients, assessment of performance in triage and outcome prediction: a comparative study of different methods",Alireza Almasi NokianiRazieh ShahnazariMohammad Amin AbbasiFarshad DivsalarMarzieh BayazidiAzadeh Sadatnaseri,53,,2022,http://link.springer.com/article/10.1186/s43055-022-00781-5
,Successful application of wastewater-based epidemiology in prediction and monitoring of the second wave of COVID-19 with fragmented sewerage systems–a case study of Jaipur (India),Sudipti AroraAditi NagAakanksha KalraVikky SinhaEkta MeenaSamvida SaxenaDevanshi SutariaManpreet KaurTamanna PamnaniKomal SharmaSonika SaxenaSandeep K. ShrivastavaA. B. GuptaXuan LiGuangming Jiang,194,,2022,http://link.springer.com/article/10.1007/s10661-022-09942-5
,ET-NET: an ensemble of transfer learning models for prediction of COVID-19 infection through chest CT-scan images,Rohit KunduPawan Kumar SinghMassimiliano FerraraAli AhmadianRam Sarkar,81,,2022,http://link.springer.com/article/10.1007/s11042-021-11319-8
,Development and validation of an individualized nomogram for early prediction of the duration of SARS-CoV-2 shedding in COVID-19 patients with non-severe disease,Shijin YuanYong PanYan XiaYan ZhangJiangnan ChenWei ZhengXiaoping XuXinyou XieJun Zhang,22,,2021,http://link.springer.com/article/10.1631/jzus.B2000608
,Electrocardiogram-based mortality prediction in patients with COVID-19 using machine learning,R. R. van de LeurH. BleijendaalK. TahaT. MastJ. M. I. H. GhoM. LinschotenB. van ReesM. T. H. M. HenkensS. HeymansN. SturkenboomR. A. TioJ. A. OfferhausW. L. BorM. MaarseH. E. Haerkens-ArendsM. Z. H. Kolk,30,,2022,http://link.springer.com/article/10.1007/s12471-022-01670-2
,A new QoE-based prediction model for evaluating virtual education systems with COVID-19 side effects using data mining,Chen TanJianzhong Lin,,,2021,http://link.springer.com/article/10.1007/s00500-021-05932-w
,Simulation of the COVID-19 patient flow and investigation of the future patient arrival using a time-series prediction model: a real-case study,Mahdieh TavakoliReza Tavakkoli-MoghaddamReza MesbahiMohssen Ghanavati-NejadAmirreza Tajally,60,,2022,http://link.springer.com/article/10.1007/s11517-022-02525-z
,Statistical analysis of blood characteristics of COVID-19 patients and their survival or death prediction using machine learning algorithms,Rahil MazloumiSeyed Reza AbazariFarnaz NafariehAmir AghsamiFariborz Jolai,,,2022,http://link.springer.com/article/10.1007/s00521-022-07325-y
,Network-based prediction of COVID-19 epidemic spreading in Italy,Clara PizzutiAnnalisa SocievoleBastian PrassePiet Van Mieghem,5,,2020,http://link.springer.com/article/10.1007/s41109-020-00333-8
,Designing a hybrid reinforcement learning based algorithm with application in prediction of the COVID-19 pandemic in Quebec,Soheyl KhalilpourazariHossein Hashemi Doulabi,,,2021,http://link.springer.com/article/10.1007/s10479-020-03871-7
,Deep Learning-Based Potential Ligand Prediction Framework for COVID-19 with Drug–Target Interaction Model,Shatadru MajumdarSoumik Kumar NandiShuvam GhosalBavrabi GhoshWritam MallikNilanjana Dutta RoyArindam BiswasSubhankar MukherjeeSouvik PalNabarun Bhattacharyya,,,2021,http://link.springer.com/article/10.1007/s12559-021-09840-x
,A systematic review of prediction models to diagnose COVID-19 in adults admitted to healthcare centers,Médéa LocquetAnh Nguyet DiepCharlotte BeaudartNadia DardenneChristian BrabantOlivier BruyèreAnne-Françoise Donneau,79,,2021,http://link.springer.com/article/10.1186/s13690-021-00630-3
,Facilitating standardized COVID-19 suspicion prediction based on computed tomography radiomics in a multi-demographic setting,Yeshaswini NagarajGonda de JongeAnna AndreychenkoGabriele PrestiMatthias A. FinkNikolay PavlovCarlo C. QuattrocchiSergey MorozovRaymond VeldhuisMatthijs OudkerkPeter M. A. van Ooijen,,,2022,http://link.springer.com/article/10.1007/s00330-022-08730-6
,COVID-19 pandemic and unemployment rate: A hybrid unemployment rate prediction approach for developed and developing countries of Asia,Han LaiYousaf Ali KhanAdel ThaljaouiWathek ChammamSyed Zaheer Abbas,,,2021,http://link.springer.com/article/10.1007/s00500-021-05871-6
,Analysis and prediction of confirmed COVID-19 cases in China with uncertain time series,Tingqing YeXiangfeng Yang,20,,2021,http://link.springer.com/article/10.1007/s10700-020-09339-4
,Nomogram for prediction of fatal outcome in patients with severe COVID-19: a multicenter study,Yun YangXiao-Fei ZhuJian HuangCui ChenYang ZhengWei HeLing-Hao ZhaoQian GaoXuan-Xuan HuangLi-Juan FuYu ZhangYan-Qin ChangHuo-Jun ZhangZhi-Jie Lu,8,,2021,http://link.springer.com/article/10.1186/s40779-021-00315-6
,COVID-19 cases prediction in multiple areas via shapelet learning,Zhijin WangBing Cai,52,,2022,http://link.springer.com/article/10.1007/s10489-021-02391-6
,Machine-learning-based COVID-19 mortality prediction model and identification of patients at low and high risk of dying,Mohammad M. BanoeiRoshan DinparastisalehAli Vaeli ZadehMehdi Mirsaeidi,25,,2021,http://link.springer.com/article/10.1186/s13054-021-03749-5
,Machine learning approaches in Covid-19 severity risk prediction in Morocco,Mariam LaatifiSamira DouziAbdelaziz BouklouzHind EzzineJaafar JaafariYounes ZaidBouabid El OuahidiMariam Naciri,9,,2022,http://link.springer.com/article/10.1186/s40537-021-00557-0
,Early prediction of lung lesion progression in COVID-19 patients with extended CT ventilation imaging,Cheng WangLu HuangSa XiaoZimeng LiChaohui YeLiming XiaXin Zhou,48,,2021,http://link.springer.com/article/10.1007/s00259-021-05435-8
,Expert recommendations based on link prediction during the COVID-19 outbreak,Hui WangZiChun Le,126,,2021,http://link.springer.com/article/10.1007/s11192-021-03893-3
,An incremental learning approach to prediction models of SEIRD variables in the context of the COVID-19 pandemic,E. CamargoJ. AguilarY. QuinteroF. RivasD. Ardila,,,2022,http://link.springer.com/article/10.1007/s12553-022-00668-5
,NSGA-II as feature selection technique and AdaBoost classifier for COVID-19 prediction using patient’s symptoms,Makram SouiNesrine MansouriRaed AlhamadMarouane KessentiniKhaled Ghedira,106,,2021,http://link.springer.com/article/10.1007/s11071-021-06504-1
,Kalman filter based short term prediction model for COVID-19 spread,Koushlendra Kumar SinghSuraj KumarPrachi DixitManish Kumar Bajpai,51,,2021,http://link.springer.com/article/10.1007/s10489-020-01948-1
,COVID-19 ICU mortality prediction: a machine learning approach using SuperLearner algorithm,Giulia LorenzoniNicolò SellaAnnalisa BoscoloDanila AzzolinaPatrizia BartolottaLaura PasinTommaso PettenuzzoAlessandro De CassaiFabio BarattoFabio ToffolettoSilvia De RosaGiorgio FullinMario PetaPaolo RosiEnrico PolatiAlberto Zanella,1,,2021,http://link.springer.com/article/10.1186/s44158-021-00002-x
,A Hybrid Model based on mBA-ANFIS for COVID-19 Confirmed Cases Prediction and Forecast,Sohail SaifPriya DasSuparna Biswas,102,,2021,http://link.springer.com/article/10.1007/s40031-021-00538-0
,Prediction of COVID-19 Cases from the Nexus of Air Quality and Meteorological Phenomena: Bangladesh Perspective,Mim Mashrur AhmedMd. Emdadul HoqueShahanaj RahmanProshanta Kumar RoyFiroz AlamMuhammad Mustafizur RahmanMd. Mostafizur RahmanPhilip K. Hopke,6,,2022,http://link.springer.com/article/10.1007/s41748-021-00278-7
,Optimization using the firefly algorithm of ensemble neural networks with type-2 fuzzy integration for COVID-19 time series prediction,Patricia MelinDaniela SánchezJulio Cesar MonicaOscar Castillo,,,2021,http://link.springer.com/article/10.1007/s00500-020-05549-5
,Biserial targeted feature projection based radial kernel regressive deep belief neural learning for covid-19 prediction,S. Subash Chandra BoseA. Vinoth KumarAnitha PremkumarM. DeepikaM. Gokilavani,,,2022,http://link.springer.com/article/10.1007/s00500-022-06943-x
,India perspective: CNN-LSTM hybrid deep learning model-based COVID-19 prediction and current status of medical resource availability,Shwet KetuPramod Kumar Mishra,26,,2022,http://link.springer.com/article/10.1007/s00500-021-06490-x
,Prediction and identification of T cell epitopes of COVID-19 with balanced cytokine response for the development of peptide based vaccines,MedhaParul BhattPriyankaMonika SharmaSadhna Sharma,9,,2021,http://link.springer.com/article/10.1007/s40203-021-00098-7
,Deep learning-based exchange rate prediction during the COVID-19 pandemic,Mohammad Zoynul AbedinMahmudul Hasan MoonM. Kabir HassanPetr Hajek,,,2021,http://link.springer.com/article/10.1007/s10479-021-04420-6
,Anti-inflammatory response of cardamom extract and prediction of therapeutic window in COVID-19 patients by assessing inflammatory markers using RT-PCR,Nourin ShakeebPrashanth VarkeyAimy HynseAjit Mandlecha,30,,2022,http://link.springer.com/article/10.1007/s10787-022-00951-x
,COVID-19 mortality prediction in the intensive care unit with deep learning based on longitudinal chest X-rays and clinical data,Jianhong ChengJohn SolleeCelina HsiehHailin YueNicholas VandalJustin ShanahanJi Whae ChoiThi My Linh TranKasey HalseyFranklin IheanachoJames WarrenAbdullah AhmedCarsten EickhoffMichael FeldmanEduardo Mortani Barbosa JrIhab Kamel,,,2022,http://link.springer.com/article/10.1007/s00330-022-08588-8
,Nature inspired optimization model for classification and severity prediction in COVID-19 clinical dataset,L. S. SumaH. S. AnandS. S. Vinod chandra,,,2021,http://link.springer.com/article/10.1007/s12652-021-03389-1
,Analysis and Prediction of COVID-19 Pandemic in Bangladesh by Using ANFIS and LSTM Network,Anjir Ahmed ChowdhuryKhandaker Tabin HasanKhadija Kubra Shahjalal Hoque,13,,2021,http://link.springer.com/article/10.1007/s12559-021-09859-0
,Prediction of the incubation period for COVID-19 and future virus disease outbreaks,Ayal B. GussowNoam AuslanderYuri I. WolfEugene V. Koonin,18,,2020,http://link.springer.com/article/10.1186/s12915-020-00919-9
,A hybrid data envelopment analysis—artificial neural network prediction model for COVID-19 severity in transplant recipients,Ignacio RevueltaFrancisco J. Santos-ArteagaEnrique Montagud-MarrahiPedro Ventura-AguiarDebora Di CaprioFrederic CofanDavid CucchiariVicens TorregrosaGaston Julio PiñeiroNuria EsforzadoMarta BodroJessica Ugalde-AltamiranoAsuncion MorenoJosep M. CampistolAntonio AlcarazBeatriu Bayès,54,,2021,http://link.springer.com/article/10.1007/s10462-021-10008-0
,"Towards a geocomputational landscape epidemiology: surveillance, modelling, and interventions",Colin Robertson,82,,2017,http://link.springer.com/article/10.1007/s10708-015-9688-5
,Pythagorean fuzzy time series model based on Pythagorean fuzzy c-means and improved Markov weighted in the prediction of the new COVID-19 cases,Sidong XianYue Cheng,25,,2021,http://link.springer.com/article/10.1007/s00500-021-06259-2
,The Evolution of Polycentric Governance in the Galapagos Small-Scale Fishing Sector,Renato CáceresJeremy PittmanMauricio CastrejónPeter Deadman,,,2022,http://link.springer.com/article/10.1007/s00267-022-01666-z
,In the future simulations will replace clinical trials,Martin A. EbertVal GebskiClive Baldock,44,,2021,http://link.springer.com/article/10.1007/s13246-021-01079-y
,EpiK: A Knowledge Base for Epidemiological Modeling and Analytics of Infectious Diseases,S.M.Shamimul HasanEdward A. FoxKeith BissetMadhav V. Marathe,1,,2017,http://link.springer.com/article/10.1007/s41666-017-0010-9
,BAST newsletter—June 2020,Paolo Di GirolamoSilvana Di SabatinoCristina L. ArcherStefano SerafinM. Marcello Miglietta,1,,2020,http://link.springer.com/article/10.1007/s42865-020-00014-5
,A new mechanism of rule acquisition based on covering rough sets,Xiaoping ZhangJinjin LiWeikang Li,,,2022,http://link.springer.com/article/10.1007/s10489-021-03067-x
,"Multiscale analysis of factors affecting food security in China, 1980–2017",Furong LvLongyun DengZhengtao ZhangZheye WangQuanyuan WuJianmin Qiao,29,,2022,http://link.springer.com/article/10.1007/s11356-021-16125-1
,HRNET: AI-on-Edge for Mask Detection and Social Distancing Calculation,Kinshuk SenguptaPraveen Ranjan Srivastava,3,,2022,http://link.springer.com/article/10.1007/s42979-022-01023-1
,Sensitivity Analysis in an Immuno-Epidemiological Vector-Host Model,Hayriye GulbudakZhuolin QuFabio MilnerNecibe Tuncer,84,,2022,http://link.springer.com/article/10.1007/s11538-021-00979-0
,"13th EBSA congress, July 24–28, 2021, Vienna, Austria",,50,,2021,http://link.springer.com/article/10.1007/s00249-021-01558-w
,Brain disease diagnosis using local binary pattern and steerable pyramid,Vandana V. KaleSatish T. HamdeRaghunath S. Holambe,8,,2019,http://link.springer.com/article/10.1007/s13735-019-00174-x
,Measuring spatial inhomogeneity at different spatial scales using hybrids of Gibbs point process models,Adina IftimiFrancisco MontesJorge MateuCarlos Ayyad,31,,2017,http://link.springer.com/article/10.1007/s00477-016-1264-0
,SIRA: Scale illumination rotation affine invariant mask R-CNN for pedestrian detection,Ujwalla GawandeKamal HajariYogesh Golhar,,,2022,http://link.springer.com/article/10.1007/s10489-021-03073-z
,"CARS 2021: Computer Assisted Radiology and Surgery Proceedings of the 35th International Congress and Exhibition Munich, Germany, June 21–25, 2021",,16,,2021,http://link.springer.com/article/10.1007/s11548-021-02375-4
,ECR 2018 - BOOK OF ABSTRACTS,,9,,2018,http://link.springer.com/article/10.1007/s13244-018-0603-8
,Reverse vaccinology assisted designing of multiepitope-based subunit vaccine against SARS-CoV-2,Muhammad Tahir ul QamarFarah ShahidSadia AslamUsman Ali AshfaqSidra AslamIsrar FatimaMuhammad Mazhar FareedAli ZohaibLing-Ling Chen,9,,2020,http://link.springer.com/article/10.1186/s40249-020-00752-w
,Correction to: Prediction of unfavorable outcomes in cryptococcal meningitis: results of the multicenter infectious Diseases International Research Initiative (ID-IRI) cryptococcal meningitis study,I. N. HakyemezH. ErdemG. BeraudM. LurdesA. Silva-PintoC. AlexandruB. BishopF. ManganiX. ArgemiM. PoinotR. HasbunM. SunbulM. AkcaerS. AlpT. DemirdalK. Angamuthu,37,,2018,http://link.springer.com/article/10.1007/s10096-018-3281-z
,Dynamic mode decomposition in adaptive mesh refinement and coarsening simulations,Gabriel F. BarrosMalú GraveAlex ViguerieAlessandro RealiAlvaro L. G. A. Coutinho,,,2021,http://link.springer.com/article/10.1007/s00366-021-01485-6
,A CNN based coronavirus disease prediction system for chest X-rays,Umair HafeezMuhammad UmerAhmad HameedHassan MustafaAhmed SohaibMichele NappiHamza Ahmad Madni,,,2022,http://link.springer.com/article/10.1007/s12652-022-03775-3
,The impact of non-pharmaceutical interventions on SARS-CoV-2 transmission across 130 countries and territories,Yang LiuChristian MorgensternJames KellyRachel LoweMark Jit,19,,2021,http://link.springer.com/article/10.1186/s12916-020-01872-8
,ECR 2019: Book of Abstracts,,10,,2019,http://link.springer.com/article/10.1186/s13244-019-0713-y
,Cascaded parallel crowd counting network with multi-resolution collaborative representation,Lei LyuRun HanZiming Chen,,,2022,http://link.springer.com/article/10.1007/s10489-022-03639-5
,SARFIMA model prediction for infectious diseases: application to hemorrhagic fever with renal syndrome and comparing with SARIMA,Chang QiDandan ZhangYuchen ZhuLili LiuChunyu LiZhiqiang WangXiujun Li,20,,2020,http://link.springer.com/article/10.1186/s12874-020-01130-8
,An intelligent computer-aided approach for target protein prediction in infectious diseases,D. NarmadhaA. Pravin,24,,2020,http://link.springer.com/article/10.1007/s00500-020-04815-w
,"Recurrent neural network ensemble, a new instrument for the prediction of infectious diseases",Alessandro Puleio,136,,2021,http://link.springer.com/article/10.1140/epjp/s13360-021-01285-3
,Nourishing nations during pandemics: why prioritize fish diets and aquatic foods in Africa,Ahmed KhanSiham Mohamed AhmedCheikh SarrYoussouf KaboreGracia KahashaLewis BangweWalter OdhiamboNathalie GahungaBernice McleanHamady DiopHellen MoepiMohamed SeisayAmadou TallEshete DejenMotseki HlatshwayoAnna Lartey,20,,2021,http://link.springer.com/article/10.1007/s40152-021-00236-z
,Recent applications of quantitative systems pharmacology and machine learning models across diseases,Sara Sadat AghamiriRada AminTomáš Helikar,49,,2022,http://link.springer.com/article/10.1007/s10928-021-09790-9
,A review on Deep Learning approaches for low-dose Computed Tomography restoration,K. A. Saneera Hemantha KulathilakeNor Aniza AbdullahAznul Qalid Md SabriKhin Wee Lai,,,2021,http://link.springer.com/article/10.1007/s40747-021-00405-x
,"COVITALE 2020 from eastern Indian population: imageologists perspective, a learning curve",Kamal Kumar SenRoopak DubeyMayank GoyalHumsheer SethiAjay SharawatRohit Arora,52,,2021,http://link.springer.com/article/10.1186/s43055-021-00634-7
,Medical image analysis based on deep learning approach,Muralikrishna PuttaguntaS. Ravi,80,,2021,http://link.springer.com/article/10.1007/s11042-021-10707-4
,Climate change and multi-dimensional sustainable urbanization,Mingxing ChenYue XianPengling WangZijin Ding,31,,2021,http://link.springer.com/article/10.1007/s11442-021-1895-z
,"Proceedings of the World Molecular Imaging Congress 2017, Philadelphia, Pennsylvania, September 13-16, 2017: General Abstracts",,19,,2017,http://link.springer.com/article/10.1007/s11307-017-1138-y
,Deletion of ER-retention motif on SARS-CoV-2 spike protein reduces cell hybrid during cell–cell fusion,Xuening WangChih-Hsiung ChenSaiaditya BadetiJong Hyun ChoAlireza NaghizadehZiren WangDongfang Liu,11,,2021,http://link.springer.com/article/10.1186/s13578-021-00626-0
,Multicenter Assessment of CT Pneumonia Analysis Prototype for Predicting Disease Severity and Patient Outcome,Fatemeh HomayouniehMarcio Aloisio Bezerra Cavalcanti RockenbachShadi EbrahimianRuhani Doda KheraBernardo C. BizzoVarun BuchRosa BabaeiHadi Karimi MobinIman MohseniMatthias MitschkeMathis ZimmermannFelix DurlakFranziska RauchSubba R DigumarthyMannudeep K. Kalra,34,,2021,http://link.springer.com/article/10.1007/s10278-021-00430-9
,A robust blind medical image watermarking approach for telemedicine applications,Fares KahlessenaneAmine KhaldiRedouane KafiSalah Euschi,24,,2021,http://link.springer.com/article/10.1007/s10586-020-03215-x
