,High-resolution epidemic simulation using within-host infection and contact data,Van Kinh NguyenRafael MikolajczykEsteban Abelardo Hernandez-Vargas,18,,2018,http://link.springer.com/article/10.1186/s12889-018-5709-x
,The fabric of Post-Western sociology: ecologies of knowledge beyond the “East” and the “West”,Laurence Roulleau-Berger,8,,2021,http://link.springer.com/article/10.1186/s40711-021-00144-z
,Challenges in modeling complexity of neglected tropical diseases: a review of dynamics of visceral leishmaniasis in resource limited settings,Swati DebRoyOlivia ProsperAustin MishoeAnuj Mubayi,14,,2017,http://link.springer.com/article/10.1186/s12982-017-0065-3
,Augment Reality-Based Teaching Practice,You WuMingzhen ZhangXiaosi LiYu GanChao Zhao,1,,2021,http://link.springer.com/article/10.1007/s43683-020-00040-x
,Analytics and visualization tools to characterize single-cell stochasticity using bacterial single-cell movie cytometry data,Athanasios D. BalomenosVictoria StefanouElias S. Manolakos,22,,2021,http://link.springer.com/article/10.1186/s12859-021-04409-9
,Unraveling the complex and dynamic Himalayan socio-ecological systems: a systematic review,A. T. Shruthi GopirajanPraveen KumarP. K. Joshi,24,,2022,http://link.springer.com/article/10.1007/s10668-021-01527-5
,Network Analysis as a Computational Technique and Its Benefaction for Predictive Analysis of Healthcare Data: A Systematic Review,Rashmeet ToorInderveer Chana,28,,2021,http://link.springer.com/article/10.1007/s11831-020-09435-z
,Automated post scoring: evaluating posts with topics and quoted posts in online forum,Ruosong YangJiannong CaoZhiyuan WenJiaxing Shen,25,,2022,http://link.springer.com/article/10.1007/s11280-022-01005-6
,O-WCNN: an optimized integration of spatial and spectral feature map for arrhythmia classification,Manisha JangraSanjeev Kumar DhullKrishna Kant SinghAkansha SinghXiaochun Cheng,,,2021,http://link.springer.com/article/10.1007/s40747-021-00371-4
,DCU-Net: a dual-channel U-shaped network for image splicing forgery detection,Hongwei DingLeiyang ChenQi TaoZhongwang FuLiang DongXiaohui Cui,,,2021,http://link.springer.com/article/10.1007/s00521-021-06329-4
,Reflecting on twenty years of international agreements concerning water governance: insights and key learning,Naho MirumachiMargot Hurlbert,22,,2022,http://link.springer.com/article/10.1007/s10784-022-09564-9
,Usage and implementation of neuro-fuzzy systems for classification and prediction in the diagnosis of different types of medical disorders: a decade review,Haneet KourJatinder ManhasVinod Sharma,53,,2020,http://link.springer.com/article/10.1007/s10462-020-09804-x
,Cell-free nucleic acid patterns in disease prediction and monitoring—hype or hope?,Adriana Torres CrignaMarek SamecLenka KoklesovaAlena LiskovaFrank A. GiordanoPeter KubatkaOlga Golubnitschaja,11,,2020,http://link.springer.com/article/10.1007/s13167-020-00226-x
,Do biosphere reserves bolster community resilience in coupled human and natural systems? Evidence from 5 case studies in Spain,Jose V. de LucioFrancisco Seijo,16,,2021,http://link.springer.com/article/10.1007/s11625-021-01029-3
,"Methods for Evaluation of medical prediction Models, Tests And Biomarkers (MEMTAB) 2020 Symposium",,5,,2021,http://link.springer.com/article/10.1186/s41512-021-00094-7
,Towards a more healthy conservation paradigm: integrating disease and molecular ecology to aid biological conservation†,Pooja GuptaV. V. RobinGuha Dharmarajan,99,,2020,http://link.springer.com/article/10.1007/s12041-020-01225-7
,A paced multi-stage block-wise approach for object detection in thermal images,Shreyas Bhat KeraAnand TadepalliJ. Jennifer Ranjani,,,2022,http://link.springer.com/article/10.1007/s00371-022-02445-x
,A lossless DWT-SVD domain watermarking for medical information security,Narima ZermiAmine KhaldiMed Redouane KafiFares KahlessenaneSalah Euschi,80,,2021,http://link.springer.com/article/10.1007/s11042-021-10712-7
,"Drug repurposing for SARS-CoV-2: a high-throughput molecular docking, molecular dynamics, machine learning, and DFT study",Jatin KashyapDibakar Datta,,,2022,http://link.springer.com/article/10.1007/s10853-022-07195-8
,Regional differences in the health status of Chinese residents: 2003–2013,Xueyan ZhaoWeijun WangWenyu Wan,28,,2018,http://link.springer.com/article/10.1007/s11442-018-1502-0
,EANM'17,,44,,2017,http://link.springer.com/article/10.1007/s00259-017-3822-1
,Prediction of production facility priorities using Back Propagation Neural Network for bus body building industries: a post pandemic research article,A. SivakumarN. Bagath SinghD. ArulkirubakaranP. Praveen Vijaya Raj,,,2022,http://link.springer.com/article/10.1007/s11135-022-01365-1
,Applying Deep Learning to Individual and Community Health Monitoring Data: A Survey,Zhen-Jie YaoJie BiYi-Xin Chen,15,,2018,http://link.springer.com/article/10.1007/s11633-018-1136-9
,Spatiotemporal high-resolution prediction and mapping: methodology and application to dengue disease,I. Gede Nyoman Mindra JayaHenk Folmer,,,2022,http://link.springer.com/article/10.1007/s10109-021-00368-0
,The Maturation of Ethnoprimatology: Theoretical and Methodological Pluralism,Erin P. Riley,39,,2018,http://link.springer.com/article/10.1007/s10764-018-0064-4
,Arctic terrestrial biodiversity status and trends: A synopsis of science supporting the CBMP State of Arctic Terrestrial Biodiversity Report,Jason J. TaylorJames P. LawlerMora AronssonTom BarryAnne D. BjorkmanTom ChristensenStephen J. CoulsonChristine CuylerDorothee EhrichKnud FalkAlastair FrankeEva FugleiMark A. GillespieStarri HeiðmarssonToke HøyeLiza K. Jenkins,49,,2020,http://link.springer.com/article/10.1007/s13280-019-01303-w
,Multi-layered micro/nanofibrous nonwovens for functional face mask filter,Yuanqiang XuXiaomin ZhangDefang TengTienan ZhaoYing LiYongchun Zeng,,,2022,http://link.springer.com/article/10.1007/s12274-022-4350-2
,The poverty evolution of typical countries along the Belt and Road and implications from China’s poverty reduction experiences,Linna ShiYongsheng WangYansui LiuYuheng Li,32,,2022,http://link.springer.com/article/10.1007/s11442-022-1953-1
,Hippocrates and prophecies: the unfulfilled promise of prediction rules,"Claudio M. Martin MSc, MD, FRCPCFran Priestap MSc",69,,2022,http://link.springer.com/article/10.1007/s12630-021-02164-2
,Sparse MR Image Reconstruction Considering Rician Noise Models: A CNN Approach,M. V. R. ManimalaC. Dhanunjaya NaiduM. N. Giri Prasad,116,,2021,http://link.springer.com/article/10.1007/s11277-020-07725-0
,Demystifying machine learning for mortality prediction,J. M. SmitM. E. van GenderenM. J. T. ReindersD. A. M. P. J. GommersJ. H. KrijtheJ. Van Bommel,25,,2021,http://link.springer.com/article/10.1186/s13054-021-03868-z
,A voting-based ensemble deep learning method focusing on image augmentation and preprocessing variations for tuberculosis detection,Erdal TasciCaner UluturkAybars Ugur,33,,2021,http://link.springer.com/article/10.1007/s00521-021-06177-2
,Identification of transcriptomics biomarkers for the early prediction of the prognosis of septic shock from pneumopathies,Songchang ShiXiaobin PanHangwei FengShujuan ZhangSongjing ShiWei Lin,21,,2021,http://link.springer.com/article/10.1186/s12879-021-06888-w
,Feeding relations: applying Luhmann’s operational theory to the food system,Amy GuptillEmelie Peine,38,,2021,http://link.springer.com/article/10.1007/s10460-020-10185-8
,A New Index Developed for Fast Diagnosis of Meteorological Roles in Ground-Level Ozone Variations,Weihua ChenWeiwen WangShiguo JiaJingying MaoFenghua YanLianming ZhengYongkang WuXingteng ZhangYutong DongLingbin KongBuqing ZhongMing ChangMin ShaoXuemei Wang,39,,2022,http://link.springer.com/article/10.1007/s00376-021-1257-x
,Earth stewardship: Shaping a sustainable future through interacting policy and norm shifts,F. Stuart Chapin IIIElke U. WeberElena M. BennettReinette BiggsJeroen van den BerghW. Neil AdgerAnne-Sophie CrépinStephen PolaskyCarl FolkeMarten SchefferKathleen SegersonJohn M. AnderiesScott BarrettJuan-Camilo CardenasStephen R. CarpenterJoern Fischer,,,2022,http://link.springer.com/article/10.1007/s13280-022-01721-3
,Reflecting on the Anthropocene: The Call for Deeper Transformations,Karen O’Brien,50,,2021,http://link.springer.com/article/10.1007/s13280-020-01468-9
,Identities and attitudes to decentralization in multi-level states: understanding the territorial scales of political life,Ailsa HendersonMike Medeiros,19,,2021,http://link.springer.com/article/10.1057/s41295-020-00229-y
,Coupling the Macroscale to the Microscale in a Spatiotemporal Context to Examine Effects of Spatial Diffusion on Disease Transmission,Yanni XiaoChangcheng XiangRobert A. ChekeSanyi Tang,82,,2020,http://link.springer.com/article/10.1007/s11538-020-00736-9
,Advanced model systems and tools for basic and translational human immunology,Lisa E. WagarRobert M. DiFazioMark M. Davis,10,,2018,http://link.springer.com/article/10.1186/s13073-018-0584-8
,ECR 2020 Book of Abstracts,,11,,2020,http://link.springer.com/article/10.1186/s13244-020-00851-0
,Spatial and seasonal variation in occupation and abundance of common vole burrows in highly disturbed agricultural ecosystems,Ana Eugenia SantamaríaPedro P. OleaJavier ViñuelaJesús T. García,65,,2019,http://link.springer.com/article/10.1007/s10344-019-1286-2
,Exploiting aggregate channel features for urine sediment detection,Qiming SunSen YangChangyin SunWankou Yang,78,,2019,http://link.springer.com/article/10.1007/s11042-018-6241-9
,Evolving together: transboundary water governance in the Colorado River Basin,Mariana Rivera-TorresAndrea K. Gerlak,21,,2021,http://link.springer.com/article/10.1007/s10784-021-09538-3
,"Spaces of Transformative Practice: Co-producing, (Re)Making and Translating Fractional Urban Space in Gugulethu, Cape Town",Kathryn Ewing,32,,2021,http://link.springer.com/article/10.1007/s12132-021-09436-6
,"“Climate change might have caused our small harvest”: indigenous vulnerability, livelihoods, and environmental changes in lowland and high jungle indigenous communities in Peru",Dafne E. Lastra LandaClaudia V. Grados Bueno,,,2021,http://link.springer.com/article/10.1007/s13412-021-00722-0
,Urbanisation as driver of food system transformation and opportunities for rural livelihoods,Sophie de BruinJust DengerinkJasper van Vliet,13,,2021,http://link.springer.com/article/10.1007/s12571-021-01182-8
,Hydrological features and the ecological niches of mammalian hosts delineate elevated risk for Ross River virus epidemics in anthropogenic landscapes in Australia,Michael G. WalshCameron Webb,11,,2018,http://link.springer.com/article/10.1186/s13071-018-2776-x
,A Review of Mortality Risk Prediction Models in Smartphone Applications,Nino FijačkoRuth Masterson CreberLucija GosakPrimož KocbekLeona CilarPeter CreberGregor Štiglic,45,,2021,http://link.springer.com/article/10.1007/s10916-021-01776-x
,Sequence-based prediction of SARS-CoV-2 vaccine targets using a mass spectrometry-based bioinformatics predictor identifies immunogenic T cell epitopes,Asaf PoranDewi HarjantoMatthew MalloyChristina M. ArietaDaniel A. RothenbergDivya LenkalaMarit M. van BuurenTerri A. AddonaMichael S. RooneyLakshmi SrinivasanRichard B. Gaynor,12,,2020,http://link.springer.com/article/10.1186/s13073-020-00767-w
,Computational prediction of the effect of mutations in the receptor-binding domain on the interaction between SARS-CoV-2 and human ACE2,Ismail CelikAbbas KhanFenny Martha DwivanyFatimawaliDong-Qing WeiTrina Ekawati Tallei,,,2022,http://link.springer.com/article/10.1007/s11030-022-10392-x
,Current Trends in Readmission Prediction: An Overview of Approaches,Kareen TeoChing Wai YongJoon Huang ChuahYan Chai HumYee Kai TeeKaijian XiaKhin Wee Lai,,,2021,http://link.springer.com/article/10.1007/s13369-021-06040-5
,De novo design and bioactivity prediction of SARS-CoV-2 main protease inhibitors using recurrent neural network-based transfer learning,Marcos V. S. SantanaFloriano P. Silva-Jr,15,,2021,http://link.springer.com/article/10.1186/s13065-021-00737-2
,"A combination of climatic conditions determines major within-season dengue outbreaks in Guangdong Province, China",Xia WangSanyi TangJianhong WuYanni XiaoRobert A. Cheke,12,,2019,http://link.springer.com/article/10.1186/s13071-019-3295-0
,"Air-pollution prediction in smart city, deep learning approach",Abdellatif BekkarBadr HssinaSamira DouziKhadija Douzi,8,,2021,http://link.springer.com/article/10.1186/s40537-021-00548-1
,Rethinking SME default prediction: a systematic literature review and future perspectives,Francesco CiampiAlessandro GiannozziGiacomo MarziEdward I. Altman,126,,2021,http://link.springer.com/article/10.1007/s11192-020-03856-0
,A novel id-iri score: development and internal validation of the multivariable community acquired sepsis clinical risk prediction model,Husrev DiktasSerhat UysalHakan ErdemYasemin CagEgidia MiftodeGul DurmusAyşegul Ulu-KilicSelma AlabayBalint Gergely SzaboBotond LakatosRicardo FernandezPinar KorkmazMichael Cruz CalizXavier ArgemiSholpan KulzhanovaFatime Kormaz,39,,2020,http://link.springer.com/article/10.1007/s10096-019-03781-y
,Multi-context unsupervised domain adaption for HEp-2 cell classification using maximum partial classifier discrepancy,Haoran ZhaoTao RenChen WangXiaotao YangYingyou Wen,,,2022,http://link.springer.com/article/10.1007/s11227-022-04452-0
,A deep learning system that generates quantitative CT reports for diagnosing pulmonary Tuberculosis,Xukun LiYukun ZhouPeng DuGuanjing LangMin XuWei Wu,51,,2021,http://link.springer.com/article/10.1007/s10489-020-02051-1
,Impact of Annual Bacterial Epizootics on Albatross Population on a Remote Island,Audrey JaegerAmandine GambleErwan LagadecCamille LebarbenchonVincent BourretJérémy TornosChristophe BarbraudKarin LembergerKarine DelordHenri WeimerskirchJean-Baptiste ThiebotThierry BoulinierPablo Tortosa,17,,2020,http://link.springer.com/article/10.1007/s10393-020-01487-8
,Humanistic Management: What Has Love Got to Do with it?,Michael PirsonCinzia DessiMichela FlorisErnestina Giudici,6,,2021,http://link.springer.com/article/10.1007/s41463-021-00106-0
,Closed-loop and congestion control of the global carbon-climate system,Carlos A. SierraHolger MetzlerMarkus MüllerEurika Kaiser,165,,2021,http://link.springer.com/article/10.1007/s10584-021-03040-0
,A dynamic single cell-based framework for digital twins to prioritize disease genes and drug targets,Xinxiu LiEun Jung LeeSandra LiljaJoseph LoscalzoSamuel SchäferMartin SmelikMaria Regina StroblOleg SysoevHui WangHuan ZhangYelin ZhaoDanuta R. GawelBarbara BohleMikael Benson,14,,2022,http://link.springer.com/article/10.1186/s13073-022-01048-4
,Analytical modeling of the mechanics of early invasion of a merozoite into a human erythrocyte,Tamer AbdalrahmanThomas Franz,43,,2017,http://link.springer.com/article/10.1007/s10867-017-9463-6
,Comparing Artificial Neural Network Architectures for Brazilian Stock Market Prediction,Suellen Teixeira Zavadzki de PauliMariana KleinaWagner Hugo Bonat,7,,2020,http://link.springer.com/article/10.1007/s40745-020-00305-w
,Multi-type skin diseases classification using OP-DNN based feature extraction approach,Arushi JainAnnavarapu Chandra Sekhara RaoPraphula Kumar JainAjith Abraham,81,,2022,http://link.springer.com/article/10.1007/s11042-021-11823-x
,"Countering Malicious DeepFakes: Survey, Battleground, and Horizon",Felix Juefei-XuRun WangYihao HuangQing GuoLei MaYang Liu,,,2022,http://link.springer.com/article/10.1007/s11263-022-01606-8
,How does economic policy uncertainty affect CO2 emissions? A regional analysis in China,Yan LiuZepeng Zhang,29,,2022,http://link.springer.com/article/10.1007/s11356-021-15936-6
,"Looking Back, Looking Forward: Progress and Prospect for Spatial Demography",Stephen A. MatthewsLaura StibermanJames RaymerTse-Chuan YangEzra GayawanSayambhu SaitaSai Thein Than TunDaniel M. ParkerDeborah BalkStefan LeykMark MontgomeryKatherine J. CurtisDavid W. S. Wong,9,,2021,http://link.springer.com/article/10.1007/s40980-021-00084-9
,A low resource 3D U-Net based deep learning model for medical image analysis,Girija ChettyMohammad YaminMatthew White,14,,2022,http://link.springer.com/article/10.1007/s41870-021-00850-4
,Understanding the impact of temporal scale on human movement analytics,Rongxiang SuSomayeh DodgeKonstadinos G. Goulias,,,2022,http://link.springer.com/article/10.1007/s10109-021-00370-6
,A transition management framework to stimulate a circular phosphorus system,Heidi M. PetersonLawrence A. BakerRimjhim M. AggarwalTreavor H. BoyerNeng Iong Chan,24,,2022,http://link.springer.com/article/10.1007/s10668-021-01504-y
,Our future in the Anthropocene biosphere,Carl FolkeStephen PolaskyJohan RockströmVictor GalazFrances WestleyMichèle LamontMarten SchefferHenrik ÖsterblomStephen R. CarpenterF. Stuart Chapin IIIKaren C. SetoElke U. WeberBeatrice I. CronaGretchen C. DailyPartha DasguptaOwen Gaffney,50,,2021,http://link.springer.com/article/10.1007/s13280-021-01544-8
,Pooling in convolutional neural networks for medical image analysis: a survey and an empirical study,Rajendran NirthikaSiyamalan ManivannanAmirthalingam RamananRuixuan Wang,34,,2022,http://link.springer.com/article/10.1007/s00521-022-06953-8
,Finding Prediction of Interaction Between SARS-CoV-2 and Human Protein: A Data-Driven Approach,Moumita GhoshPritam SilAnirban RoyRohmatul FajriyahKartick Chandra Mondal,102,,2021,http://link.springer.com/article/10.1007/s40031-021-00569-7
,Machine learning-based diffusion model for prediction of coronavirus-19 outbreak,Supriya RahejaShreya KasturiaXiaochun ChengManoj Kumar,,,2021,http://link.springer.com/article/10.1007/s00521-021-06376-x
,Community-wide hackathons to identify central themes in single-cell multi-omics,Kim-Anh Lê CaoAl J. AbadiEmily F. Davis-MarcisakLauren HsuArshi AroraAlexis CoullombAtul DeshpandeYuzhou FengPratheepa JeganathanMelanie LothChen MengWancen MuVera PancaldiKris SankaranDario RighelliAmrit Singh,22,,2021,http://link.springer.com/article/10.1186/s13059-021-02433-9
,"Proceedings of the World Molecular Imaging Congress 2018, Seattle, Washington, September 12-15, 2018: Late-Breaking Abstracts",,20,,2018,http://link.springer.com/article/10.1007/s11307-018-01306-1
,Modulators of mercury risk to wildlife and humans in the context of rapid global change,Collin A. Eagles-SmithEllen K. SilbergeldNiladri BasuPaco BustamanteFernando Diaz-BarrigaWilliam A. HopkinsKaren A. KiddJennifer F. Nyland,47,,2018,http://link.springer.com/article/10.1007/s13280-017-1011-x
,Changing the Nature of Quantitative Biology Education: Data Science as a Driver,Raina S. RobevaJohn R. JungckLouis J. Gross,82,,2020,http://link.springer.com/article/10.1007/s11538-020-00785-0
,Impact of continuous low water stage on the breeding environment of Oncomelania hupensis: a case study of Poyang Lake area in China,Fei HuQi-Yue LiXiao-Feng DaiZhao-Jun LiShang-Biao LvChun-Fang LuYi-Feng LiMin YuanYue-Ming LiuYing LiuDan-Dan Lin,9,,2020,http://link.springer.com/article/10.1186/s40249-020-00720-4
,Climate policy conflict in the U.S. states: a critical review and way forward,Joshua A. BassechesRebecca Bromley-TrujilloMaxwell T. BoykoffTrevor CulhaneGalen HallNoel HealyDavid J. HessDavid HsuRachel M. KrauseHarland PrechelJ. Timmons RobertsJennie C. Stephens,170,,2022,http://link.springer.com/article/10.1007/s10584-022-03319-w
,Quite promising yet marginal? A comparative study of social economy in the EU South,Athina AvagianouKostas GourzisIoannis PissouriosTheodoros IosifidesStelios Gialis,,,2022,http://link.springer.com/article/10.1057/s41295-022-00288-3
,"Four propositions on integrated sustainability: toward a theoretical framework to understand the environment, peace, and sustainability nexus",Joshua FisherPoonam AroraSiqi ChenSophia RheeTempest BlaineDahlia Simangan,16,,2021,http://link.springer.com/article/10.1007/s11625-021-00925-y
,Integrating political and technological uncertainty into robust climate policy,Leslie Paul Thiele,163,,2020,http://link.springer.com/article/10.1007/s10584-020-02853-9
,No Place for Poor Men: On the Asymmetric Effect of Urbanization on Life Satisfaction,Camilla LenziGiovanni Perucca,,,2022,http://link.springer.com/article/10.1007/s11205-022-02946-1
,"Governance in the Face of Extreme Events: Lessons from Evolutionary Processes for Structuring Interventions, and the Need to Go Beyond",Simon A. LevinJohn M. AnderiesNeil AdgerScott BarrettElena M. BennettJuan Camilo CardenasStephen R. CarpenterAnne-Sophie CrépinPaul EhrlichJoern FischerCarl FolkeNils KautskyCatherine KlingKarine NyborgStephen PolaskyMarten Scheffer,25,,2022,http://link.springer.com/article/10.1007/s10021-021-00680-2
,Big data-drive agent-based modeling of online polarized opinions,Peng LuZhuo ZhangMengdi Li,7,,2021,http://link.springer.com/article/10.1007/s40747-021-00532-5
,Regenerative food systems and the conservation of change,Philip A. Loring,39,,2022,http://link.springer.com/article/10.1007/s10460-021-10282-2
,The role of universities in SDGs solution co-creation and implementation: a human-centered design and shared-action learning process,Datu Buyung Agusdinata,,,2022,http://link.springer.com/article/10.1007/s11625-022-01128-9
,"Culture, the civic, and religion: characteristics and contributions of cultural analysis through three exemplary books",Gary J. Adler Jr.,,,2022,http://link.springer.com/article/10.1057/s41290-022-00155-4
,An epigenetic and transcriptomic signature of immune tolerance in human monocytes through multi-omics integration,Xanthe BrandsBastiaan W. HaakAugustijn M. KlarenbeekJoe ButlerFabrice UhelWanhai QinNatasja A. OttoMarja E. JakobsDaniël R. FaberRené LutterW. Joost WiersingaTom van der PollBrendon P. Scicluna,13,,2021,http://link.springer.com/article/10.1186/s13073-021-00948-1
,Socio-ecological dynamics and challenges to the governance of Neglected Tropical Disease control,Edwin MichaelShirin Madon,6,,2017,http://link.springer.com/article/10.1186/s40249-016-0235-5
,Attending to scalar ethical issues in emerging approaches to environmental health research and practice,Chris G. BuseMaxwell SmithDiego S. Silva,37,,2019,http://link.springer.com/article/10.1007/s40592-018-0080-3
,Vital Data: Re/Introducing Historical Bioarchaeology,Shannon A. NovakAlanna L. Warner-Smith,54,,2020,http://link.springer.com/article/10.1007/s41636-019-00217-4
,A Survey on Deep Networks Approaches in Prediction of Sequence-Based Protein–Protein Interactions,Bhawna MewaraSoniya Lalwani,3,,2022,http://link.springer.com/article/10.1007/s42979-022-01197-8
,How deep learning is empowering semantic segmentation,Uroosa SeharMuhammad Luqman Naseem,,,2022,http://link.springer.com/article/10.1007/s11042-022-12821-3
,Impacts of meteorology and emission variations on the heavy air pollution episode in North China around the 2020 Spring Festival,Wenbo XueXurong ShiGang YanJinnan WangYanling XuQian TangYanli WangYixuan ZhengYu Lei,64,,2021,http://link.springer.com/article/10.1007/s11430-020-9683-8
,Industrial metabolism and territorial development of the Maurienne Valley (France),Magali TalandierMyriam Donsimoni,22,,2022,http://link.springer.com/article/10.1007/s10113-021-01845-4
,Enhanced Binary Hexagonal Extrema Pattern (EBHXEP) Descriptor for Iris Liveness Detection,Rohit AgarwalAnand Singh JalalK. V. Arya,115,,2020,http://link.springer.com/article/10.1007/s11277-020-07700-9
,Deep graph cut network for weakly-supervised semantic segmentation,Jiapei FengXinggang WangWenyu Liu,64,,2021,http://link.springer.com/article/10.1007/s11432-020-3065-4
,A cloud-based platform to predict wind pressure coefficients on buildings,Facundo BreJuan M. Gimenez,15,,2022,http://link.springer.com/article/10.1007/s12273-021-0881-9
,Materials-oriented integrated design and construction of structures in civil engineering—A review,Xing MingJohn C. HuangZongjin Li,16,,2022,http://link.springer.com/article/10.1007/s11709-021-0794-9
,Will it print: a manufacturability toolbox for 3D printing,Hannah D. BudinoffSara McMains,15,,2021,http://link.springer.com/article/10.1007/s12008-021-00786-w
,100+ FPS detector of personal protective equipment for worker safety: A deep learning approach for green edge computing,Xiao KeWenyao ChenWenzhong Guo,15,,2022,http://link.springer.com/article/10.1007/s12083-021-01258-4
,Investigating the biophysical and socioeconomic determinants of China tropospheric O3 pollution based on a multilevel analysis approach,Su DingJianhua HeDianfeng Liu,43,,2021,http://link.springer.com/article/10.1007/s10653-020-00797-8
,A Meta-Overview and Bibliometric Analysis of Resilience in Spatial Planning – the Relevance of Place-Based Approaches,Gabriela Carmen PascariuAlexandru BanicaPeter Nijkamp,,,2022,http://link.springer.com/article/10.1007/s12061-022-09449-z
,Modeling population heterogeneity from microbial communities to immune response in cells,Tal PechtAnna C. AschenbrennerThomas UlasAntonella Succurro,77,,2020,http://link.springer.com/article/10.1007/s00018-019-03378-w
,"Antiviral phytocompounds “ellagic acid” and “(+)-sesamin” of Bridelia retusa identified as potential inhibitors of SARS-CoV-2 3CL pro using extensive molecular docking, molecular dynamics simulation studies, binding free energy calculations, and bioactivity prediction",Abd. Kakhar UmarJames H. ZothantluangaKeerthic AswinSaipul MaulanaMuhammad Sulaiman ZubairH. LalhlenmawiaMithun RudrapalDipak Chetia,,,2022,http://link.springer.com/article/10.1007/s11224-022-01959-3
,Role of twitter user profile features in retweet prediction for big data streams,Saurabh SharmaVishal Gupta,,,2022,http://link.springer.com/article/10.1007/s11042-022-12815-1
